<?xml version="1.0" encoding="UTF-8"?>
<!--
To change this license header, choose License Headers in Project Properties.
To change this template file, choose Tools | Templates
and open the template in the editor.
-->

<estudiante xmlns:xsi="http://www.w3.org/2001/XMLSchema-instance"
            xsi:noNamespaceSchemaLocation="studentXSD.xsd">
    
    <identificacion>
    <pri_nom></pri_nom>
    <seg_nom></seg_nom>
    <pri_ape></pri_ape>
    <seg_ape></seg_ape>
    </identificacion>
    <genero></genero>
    <telefono></telefono>
    <direccion></direccion>  
    
</estudiante>
